gate,check,value,criterion,status,note
GB18.1,conforming_coarse_M084,reached=True cl_p=0.2617 (M_max 2.15),conforming Mach-ramp reaches M0.84 at coarse (proof-of-concept; under-resolved),PASS,
GB18.2,ls_coarse_ceiling,m_last_conv=0.5750000000000001 m_final=0.5875000000000001 Mmax=1.44,RECORDED: LS transonic ceiling at coarse (junction G1.6 pocket) -- the GB16.6 debt; repaid as a negative,PASS,
GB18.1,conforming_medium_M079,reached=True cl_p=0.2579; cl(M) 0.50/0.65/0.79 = 0.2173/0.2321/0.2579,conforming reaches M0.79 STRICT at medium (M0.80+ stalls; recorded); monotone transonic rise,PASS,
GB18.2,ls_medium_ceiling,m_last_conv=nan m_final=0.5 Mmax=3.96 (nlim 43/nflr 40),RECORDED: LS dies at the FIRST transonic level (~M0.5) at medium -- the junction G1.6/GB9.4 pocket WORSENS with refinement (coarse ~0.58),PASS,
GB18.4,junction_worsens_with_refinement,LS ceiling coarse 0.5875000000000001 (Mmax 1.4) -> medium 0.5 (Mmax 4.0),RECORDED: the wing-fuselage-junction spurious pocket (mixed_plain aux artifact) grows with refinement -- same sign as GB9.4,PASS,
GB18.3,cross_model,M0.5 medium: conf 0.2173 vs LS 0.2117 (2.6%),RECORDED: the only TRUSTWORTHY cross-model is M0.5 (LS cannot reach transonic at medium); a coarse transonic point is recorded,PASS,
GB18.5,fuselage_lift_M079,cl_fus 0.0423 = 16% of wing cl_p 0.2579,RECORDED: fuselage carries spurious lift (G1.6 flat-facet natural-BC error; GB9.4 class) -- persists into transonic,PASS,
