gate,check,value,criterion,status,note
TIP,conf-M1: wing-control peak converges (real flow bounded),x1.15,0.9 < ratio < 1.3,PASS,
TIP,conf-M1: tip-edge PEAK Mach diverges under refinement,max x1.38 (p95 x0.98),max ratio > 1.25,PASS,p95/mean flat => a localized edge singularity; not a broad region
TIP,ls-M1: wing-control peak converges (real flow bounded),x1.14,0.9 < ratio < 1.3,PASS,
TIP,ls-M1: tip-edge PEAK Mach diverges under refinement,max x2.28 (p95 x0.98),max ratio > 1.25,PASS,p95/mean flat => a localized edge singularity; not a broad region
TIP,ls-M4: wing-control peak converges (real flow bounded),x1.12,0.9 < ratio < 1.3,PASS,
TIP,ls-M4: tip-edge PEAK Mach diverges under refinement,max x1.74 (p95 x0.93),max ratio > 1.25,PASS,p95/mean flat => a localized edge singularity; not a broad region
TIP,same-mesh A/B: level-set does NOT blunt the edge singularity,LS x2.28 vs conforming x1.38,LS growth >= conforming,PASS,=> WAKE-MODEL defect; the representation change does not remove it (LS peak sits in the straddler cells beyond the tip)
