gate,check,value,criterion,status,note
G13.3,the REMAINING singularity is on the WALL (flat tip cap),tip-cap peak Mach 0.662 -> 1.015; p = +0.321,p > 0.15 (diverges under uniform refinement),PASS,meshgen/wing3d.py builds a FLAT tip cap (deliberate simplification); its sharp convex edge is a potential-flow edge singularity ON THE BODY. Fix = round the cap (Track M). NOT a P11 problem: curved ELEMENTS cannot regularize a sharp geometric EDGE
G13.3,the G13.2 wake-edge fix HOLDS under refinement,wake-edge peak Mach p = +0.045,p < 0.15 (bounded),PASS,the tapered free edge stays flat across the whole ladder -- the tip fix REVEALED the wall singularity; it did not cause it
G13.3,CONTROL: the ordinary wing field is mesh-converged,wing p99 Mach p = -0.014,|p| < 0.05 (converged),PASS,rules out 'the whole solution is just under-resolved' -- the divergence is localized; which is what a singularity looks like
G13.3,lift increments still GROW => NOT in the asymptotic range,cl_KJ 0.2015 -> 0.2005 -> 0.2121 (-0.48%; +5.76%),no Richardson extrapolation may be reported,PASS,P9/G9.3 discipline: report n/a; never fabricate an extrapolated value from a non-asymptotic sequence
G13.3,PROVENANCE: the fine point's clamp counters do NOT reproduce,adopted fine: conv=True; lim=0; flr=0 | reproducible fine: conv=False; lim=306; flr=138,recorded; not asserted,PASS,the two fine runs agree on the FIELD to 3 digits but not on the limiter/floor counters; the committed '0 lim / 0 flr' claim rests on a run whose script was never committed. The box-study VERDICT is unaffected (both give the same p)
